{
    "is_crisis": true,
    "crisis_severity": "high",
    "activator": "Lost job yesterday after 10 years, wife threatened divorce this morning, facing foreclosure next month",
    "belief": "My life is completely over, I'm a total failure as a husband and provider, there's no way to recover from this",
    "consequence": "Having thoughts of suicide, stopped eating for two days, isolated from family and friends, considering taking all my sleeping pills",
    "context": "Patient experiencing multiple major life stressors simultaneously with active suicidal ideation and specific means considered. Complete breakdown of coping mechanisms with social isolation and self-neglect. Requires immediate professional intervention due to high suicide risk and inability to function."
}